[
  {
    "schemaVersion": 1,
    "eventId": "synthetic-core-2026-07-20-001",
    "source": "today-core",
    "eventType": "daily-checkin",
    "createdAt": "2026-07-20T20:15:00+03:00",
    "localDate": "2026-07-20",
    "payload": { "choice": "C", "color": "navy", "note": "Sentetik test notu." }
  },
  {
    "schemaVersion": 1,
    "eventId": "synthetic-health-2026-07-20-001",
    "source": "today-health",
    "eventType": "daily-health-summary",
    "createdAt": "2026-07-20T20:20:00+03:00",
    "localDate": "2026-07-20",
    "payload": { "sleepHours": 5, "waterMl": 1800, "exerciseMinutes": 0, "energyLevel": 2 }
  }
]

